id_news,title,created_at,description,image_path
5a127c05-7ffc-4baf-94fd-36a873972eb6,Philip Morris International investing over CZK 1 billion in Kutná Hora factoryThe plant will expand its capacities for making non-combustible tobacco products as the company phases out traditional cigarettes.,2023-06-21 16:59:00,"<p>The Banking Council of the Czech National Bank (CNB) <a data-cu='"https://www.cnb.cz/en/monetary-policy/bank-board-decisions/CNB-Board-decisions-1687359600000/'" data-cwid='"1905685'" href='"https://www.cnb.cz/en/monetary-policy/bank-board-decisions/CNB-Board-decisions-1687359600000/'" target='"_blank'">has this afternoon </a>kept the base interest rate at 7 percent, as had been widely expected by analysts. SAB Finance analyst Tomáš Kudela has said that owing to gradually decelerating inflation in Czechia, a rise in interest rates is off the cards.</p><p>The Lombard rate (the interest rate charged by the CNB when giving short-term loans to other commercial banks) and bank rate (the amount of interest the CNB charges on its loans to banks) remain the same, at 8 and 6 percent respectively. The last time that the interest rate was changed was in early May 2022, when it moved from 5.75 percent to 7 percent.</p><p>The CNB declared that it wants to continue preventing excessive fluctuations in the crown, hence keeping the interest rate as it is rather than lowering it. The crown is currently trading at EUR 1: CZK 23.76 – markedly better than exactly 12 months ago, when EUR 1 was worth CZK 24.7. After strengthening to CZK 23.3 for 1 EUR in mid-April this year, it has since gradually depreciated.</p><p>According to senior economist at Komerční banka Martin Gürtler, <a data-cu='"https://www.kurzy.cz/zpravy/726250-sazby-cnb-opet-beze-zmeny-jejich-pokles-je-uz-na-obzoru-komentar/'" data-cwid='"1905695'" href='"https://www.kurzy.cz/zpravy/726250-sazby-cnb-opet-beze-zmeny-jejich-pokles-je-uz-na-obzoru-komentar/'" target='"_blank'">writing in Kurzy.cz</a>, by “the end of this year the base interest rate should fall from the current 7 percent to 6.25 percent.” </p><p>This is due to the CNB’s economic forecast, which predicts single-digit inflation in the third quarter of 2023. Gürtler expects only very gradual rate cuts and anticipates the first to come in September. Current headline inflation is at around 11 percent. The CNB predicts it to reach about 2 percent by the second quarter of 2024. Gürtler writes that he expects the CNB “to remain hawkish for the time being.”</p>",illustrative-image-istock-andria-yalanskyi-nhasz
d2ddcbd0-c15e-42b3-8e12-9dd224418954,Czech National Bank maintains interest rate at 7 percentAnalysts expect the central bank to marginally reduce the rate until the end of 2023 due to lower inflation.,2023-06-21 16:00:00,"<p>A tram painted in the colors of the Ukrainian flag of yellow and blue will run on Prague streets for at least the next six months. Prague Deputy Mayor Zdeněk Hřib and Ukrainian chargé d''affaires Vitalii Usatyi officially introduced the tram by pouring sparkling wine in front of it and making a toast. Both of them commented on the urgent need to continue helping Ukraine in its struggle against the Russian invasion.</p><p>By introducing the tram, Prague is joining an international fundraising effort called United24, which was launched by Ukrainian President Vladimir Zelenskiy. The side of the tram has a QR code that people can use to donate money, which will go to defense, clearing mines, medical assistance, rebuilding Ukraine, education, and science.</p><p>The tram, which also sports the hashtag #standwithukraine, will run mainly on the 22 line, which goes through the city center and stops at many of the main tourist destinations.</p><p>“With this step, we are joining the campaign that is already underway in several European cities, whether it is Vienna, The Hague, Vilnius, or Riga,” Hřib said. He added that the campaign could be extended beyond six months, but he hoped the conflict would be over by then.</p><p>“The effort is to draw attention to the United24 platform, which allows people to safely contribute to the support of Ukraine, whether for humanitarian aid, reconstruction of the country, demining, or directly for the defense of the country against the Russian genocide that is currently taking place there,” he added. He also said he hoped Ukraine would win the conflict with Russia.</p><p>This is not the first step for Prague to aid Ukraine, nor will it be the last. The city, for example, has already sent buses, <a data-cu='"https://www.expats.cz/czech-news/article/donated-prague-trams-are-now-running-on-the-streets-of-kharkiv'" data-cwid='"1905599'" href='"https://www.expats.cz/czech-news/article/donated-prague-trams-are-now-running-on-the-streets-of-kharkiv'" target='"_blank'">trams</a>, and diesel heaters to Ukraine, and supported the efforts of the <a data-cu='"https://www.expats.cz/czech-news/article/new-campaign-aims-to-help-ukrainian-refugees-integrate-into-czech-labor-market-1'" data-cwid='"1905599'" href='"https://www.expats.cz/czech-news/article/new-campaign-aims-to-help-ukrainian-refugees-integrate-into-czech-labor-market-1'" target='"_blank'">People in Need </a>foundation.</p><p>Chargé d''affaires Usatyi thanked Prague City Hall for the initiative, which he called a symbol of the friendly relations between Ukraine and the Czech Republic, and for the city’s “constant and unwavering support of Ukraine and temporarily displaced persons.”</p><p>Jan Šurovský, a member of the board of directors of the Prague Public Transit Company, said it was significant that a T3 model tram was selected. The vintage model, still the backbone of Prague’s fleet, was made in Prague but has been widely used in Ukraine. “These are still the dominant vehicles that can be found in Kyiv, Kharkiv, and other cities in Ukraine,” he said.</p>",t3-tram-in-ukrainian-colors-photo-raymond-johnston-iplui
ce105b1f-5145-49a7-9de4-3e6c06587ef9,"Prague rolls out tram in Ukrainian colors for humanitarian aid fundraiserThe vintage T3 tram, which will run for at least six months, has a QR code on the side for donations.",2023-06-21 13:49:00,"<p>The Czech cabinet has taken a significant step towards ratifying the Istanbul Convention on the prevention and combating of violence against women and domestic violence. </p><p>The junior government party Mayors and Independents (STAN)<a data-cu='"https://twitter.com/STANcz/status/1671462465358405632'" data-cwid='"1905575'" href='"https://twitter.com/STANcz/status/1671462465358405632'" target='"_blank'"> announced on Twitter </a>that the cabinet agreed to proceed with the ratification process and has sent the treaty to the Chamber of Deputies for a decision.</p><p>The Istanbul Convention aims to provide a comprehensive framework for combating violence against women and domestic violence, establishing legal standards, and fostering cooperation among signatory countries. Once ratified, the convention will become legally binding in Czechia, reinforcing the government''s obligation to address this critical issue.</p><p>'"Our government has recommended for approval the Convention on the Prevention and Combating of Violence against Women and Domestic Violence. What does the Istanbul Convention entail? Effective work with victims and perpetrators of violence, the prevention of violence, and the education of police, prosecutors, and lawyers,'" STAN tweeted.</p><p>Lawmakers also said in their tweet that the signing of the convention does not threaten Czech traditions like Easter, change LGBTQ+ rights, or affect migration policies.</p><p>Klára Šimáčková Laurenčíková, the government''s human rights commissioner, also confirmed on social media that the Istanbul Convention has been approved by the government for ratification. She wrote in a tweet:</p><p>'"Huge joy! The government has just approved the ratification of the Istanbul Convention. This marks a major step towards systematic and functional protection of victims of violence, strengthening prevention, and developing programs for perpetrators of violence. We now have a debate in parliament, but I believe that the way forward is open.'"</p><p>The convention, initially adopted in 2011 and signed in 2016 during the previous Czech government led by Andrej Babiš (of the ANO party), has been a source of contention in Czechia.</p><p>Opposition to the convention has been primarily driven by conservatives and seven Christian churches. However, its proponents argue that ratification will improve assistance for victims and underscore the country''s stance against violence.</p><p>In the past, the ratification process faced delays due to controversy surrounding the convention''s text, prompting previous governments – as well as current ministers – to postpone it.</p><p>However, the present coalition government, in its policy statement, emphasized that the convention will ensure enhanced protection for victims of sexual and domestic violence.</p><p>The ratification must now be approved by a simple majority in the Senate, after which the president must sign. According to a <a data-cu='"https://www.expats.cz/czech-news/article/prague-protest-to-demand-urgent-action-against-sexual-and-domestic-violence'" data-cwid='"1905584'" href='"https://www.expats.cz/czech-news/article/prague-protest-to-demand-urgent-action-against-sexual-and-domestic-violence'" target='"_blank'">recent poll by iRozhlas</a>, 10 out of 18 members of the Senate would vote for the ratification of the Istanbul Convention.</p><p>By taking this step towards ratification, the Czech government aims to strengthen its efforts to combat violence against women and domestic violence, promoting a society where such acts are unequivocally condemned.</p>",women-at-a-march-against-domestic-violence-in-prague-in-2022-photo-via-best-tr-fxxzg
e2035548-6380-4190-8a3f-fd29ff4bdc49,Czech government approves ratification of the Istanbul ConventionThe move marks a significant step toward the ratification of the Istanbul Convention on the prevention of violence against women.,2023-06-21 13:30:00,"<p>Last year proved successful for the housing construction industry, with 39,398 new dwellings completed. This represents an increase of 13.9 percent compared to the previous year and marks the second-highest number of completed <a data-cu='"https://www.expats.cz/praguerealestate'" data-cwid='"1904941'" href='"https://www.expats.cz/praguerealestate'" target='"_blank'">apartments</a> since 2000, coming close to the peak achieved in 2007, according to the <a data-cu='"https://www.czso.cz/csu/czso/bytove-vystavbe-se-loni-mimoradne-darilo'" data-cwid='"1904941'" href='"https://www.czso.cz/csu/czso/bytove-vystavbe-se-loni-mimoradne-darilo'" target='"_blank'">Czech Statistical Office</a> (ČSÚ).</p><p>The number of completed new <a data-cu='"https://www.expats.cz/praguerealestate'" data-cwid='"1904942'" href='"https://www.expats.cz/praguerealestate'" target='"_blank'">flats</a> was the second highest number since 2000, and significantly close to the peak in 2007. “For flats in family houses, it was even the most since the boom in the 1970s; no other year has seen more than 20,000 flats completed,” Silvie Lukavcová, a representative from the ČSÚ''s department of construction and housing statistics. The year-on-year increase included flats in both family houses and <a data-cu='"https://www.expats.cz/praguerealestate'" data-cwid='"1904942'" href='"https://www.expats.cz/praguerealestate'" target='"_blank'">apartment</a> buildings.</p><p>Central Bohemia has the largest share of new flats of any Czech region, with 20 percent. This region primarily saw the construction of <a data-cu='"https://www.expats.cz/praguerealestate'" data-cwid='"1904943'" href='"https://www.expats.cz/praguerealestate'" target='"_blank'">apartments</a> within family houses. Prague, on the other hand, remained a significant driver of construction activity, particularly in apartment buildings.</p><p>While most regions experienced positive growth in completed apartments, the Vysočina and South Moravia regions faced a marginal decline. The Karlovy Vary region reported the fewest number of completed<a data-cu='"https://www.expats.cz/praguerealestate'" data-cwid='"1904944'" href='"https://www.expats.cz/praguerealestate'" target='"_blank'"> apartments</a>.</p><p>However, alongside the positive developments, the housing construction sector faced challenges in terms of construction timelines and costs. Apartment buildings, in particular, experienced extended construction periods, now averaging 41 months per building. Single-family houses took slightly less time to complete, with an average duration of 40 months.</p><p>The time required to build a house may change, as a new law intended to <a data-cu='"https://www.expats.cz/czech-news/article/czech-president-signs-law-streamlining-approval-process-for-home-builders-and-developers'" data-cwid='"1904946'" href='"https://www.expats.cz/czech-news/article/czech-president-signs-law-streamlining-approval-process-for-home-builders-and-developers'" target='"_blank'">streamline the permitting process</a> was passed this year and will take effect for new residential projects on July 1, 2024.</p><p>Construction costs also saw an increase. Year-on-year, the investment costs for constructing an apartment in a family house rose by CZK 400,000, while apartments in buildings experienced an average increase of CZK 140,000.</p><p>Despite the challenges, the size of the completed apartments remained relatively consistent compared to the previous year. Noteworthy changes were observed in construction materials, with a majority of new family houses featuring brick supporting structures. Wooden buildings accounted for a smaller proportion, representing 14.1 percent of new construction. Additionally, approximately 70 percent of houses lacked a connection to the gas pipeline system.</p><p>Regarding energy performance, there were minor shifts in building ratings. The extremely economical A class maintained its share at 8.9 percent, while the B class experienced a five-percentage-point decline in favor of the C class.</p>",photo-via-getty-images-tattywelshie-yhayo
d89f61a0-0578-4987-bb32-41b857096438,"Impressive growth in Czech housing construction: Second highest number of new flats since 2000The largest share of new flats was in Central Bohemia, while the Karlovy Vary region had the worst performance.",2023-06-21 13:30:00,"<p>Last year proved successful for the housing construction industry, with 39,398 new dwellings completed. This represents an increase of 13.9 percent compared to the previous year and marks the second-highest number of completed <a data-cu='"https://www.expats.cz/praguerealestate'" data-cwid='"1904941'" href='"https://www.expats.cz/praguerealestate'" target='"_blank'">apartments</a> since 2000, coming close to the peak achieved in 2007, according to the <a data-cu='"https://www.czso.cz/csu/czso/bytove-vystavbe-se-loni-mimoradne-darilo'" data-cwid='"1904941'" href='"https://www.czso.cz/csu/czso/bytove-vystavbe-se-loni-mimoradne-darilo'" target='"_blank'">Czech Statistical Office</a> (ČSÚ).</p><p>The number of completed new <a data-cu='"https://www.expats.cz/praguerealestate'" data-cwid='"1904942'" href='"https://www.expats.cz/praguerealestate'" target='"_blank'">flats</a> was the second highest number since 2000, and significantly close to the peak in 2007. “For flats in family houses, it was even the most since the boom in the 1970s; no other year has seen more than 20,000 flats completed,” Silvie Lukavcová, a representative from the ČSÚ''s department of construction and housing statistics. The year-on-year increase included flats in both family houses and <a data-cu='"https://www.expats.cz/praguerealestate'" data-cwid='"1904942'" href='"https://www.expats.cz/praguerealestate'" target='"_blank'">apartment</a> buildings.</p><p>Central Bohemia has the largest share of new flats of any Czech region, with 20 percent. This region primarily saw the construction of <a data-cu='"https://www.expats.cz/praguerealestate'" data-cwid='"1904943'" href='"https://www.expats.cz/praguerealestate'" target='"_blank'">apartments</a> within family houses. Prague, on the other hand, remained a significant driver of construction activity, particularly in apartment buildings.</p><p>While most regions experienced positive growth in completed apartments, the Vysočina and South Moravia regions faced a marginal decline. The Karlovy Vary region reported the fewest number of completed<a data-cu='"https://www.expats.cz/praguerealestate'" data-cwid='"1904944'" href='"https://www.expats.cz/praguerealestate'" target='"_blank'"> apartments</a>.</p><p>However, alongside the positive developments, the housing construction sector faced challenges in terms of construction timelines and costs. Apartment buildings, in particular, experienced extended construction periods, now averaging 41 months per building. Single-family houses took slightly less time to complete, with an average duration of 40 months.</p><p>The time required to build a house may change, as a new law intended to <a data-cu='"https://www.expats.cz/czech-news/article/czech-president-signs-law-streamlining-approval-process-for-home-builders-and-developers'" data-cwid='"1904946'" href='"https://www.expats.cz/czech-news/article/czech-president-signs-law-streamlining-approval-process-for-home-builders-and-developers'" target='"_blank'">streamline the permitting process</a> was passed this year and will take effect for new residential projects on July 1, 2024.</p><p>Construction costs also saw an increase. Year-on-year, the investment costs for constructing an apartment in a family house rose by CZK 400,000, while apartments in buildings experienced an average increase of CZK 140,000.</p><p>Despite the challenges, the size of the completed apartments remained relatively consistent compared to the previous year. Noteworthy changes were observed in construction materials, with a majority of new family houses featuring brick supporting structures. Wooden buildings accounted for a smaller proportion, representing 14.1 percent of new construction. Additionally, approximately 70 percent of houses lacked a connection to the gas pipeline system.</p><p>Regarding energy performance, there were minor shifts in building ratings. The extremely economical A class maintained its share at 8.9 percent, while the B class experienced a five-percentage-point decline in favor of the C class.</p>",photo-via-getty-images-tattywelshie-yhayo
a674409f-5d23-4869-8145-98783f84318e,"Most modern psychiatric facility in Central Europe opens near PragueAt the opening ceremony, Czech Prime Minister Petr Fiala spoke about the need to improve Czechia''s mental health services.",2023-06-21 11:00:00,"<p>A brand new psychiatric unit that opened Tuesday in Beroun, Central Bohemia is possibly the most modern and advanced psychiatric facility in Central Europe. Located in the Beroun Rehabilitation Hospital, the center is set to accommodate over 200 patients and provide around 300 jobs. It cost around CZK 1.2 billion to build.</p><p>At the center’s opening, Minister of Health Vlastimil Válek pointed out that the Central Bohemian Region has so far lacked a large psychiatric facility. </p><p>The new center will provide various types of facilities, including art and music therapy, a sauna, virtual-reality devices, and a gym. At present, it provides inpatient care and plans to open an acute, emergency service in 2023 according to its <a data-cu='"https://www.cdr-akeso.cz/nase-vize-pece/nejcastejsi-dotazy'" data-cwid='"1905332'" href='"https://www.cdr-akeso.cz/nase-vize-pece/nejcastejsi-dotazy'" target='"_blank'">website</a>. The facility says that it has a contractual relationship with all health insurance companies.</p><p>'"We are bringing several fundamental care innovations. We concentrate good practices from many other facilities in one place. New technologies will also be an advantage. For example, we are proud of [our use of] circadian biodynamic lighting,” said a psychiatrist who will work at the center, Martin Hollý.</p><p>Válek said that the new unity is funded via private sources – this is a rarity, he says, because “psychiatry is not seen as a field that is economically profitable for a private entrepreneur.” He also explained that many hospitals technically lose money on psychiatric wards.</p><p>AKESO Holding, which belongs to Greek businessman Sotirios Zavalianis, is the owner of the hospital. AKESO also runs the Hořovice hospital, the Multiscan Pardubice radiology and oncology center, and a diagnostic center in Prague''s Nové Butovice area.</p><p>According to statistics, one in five Czechs suffer from some form of mental illness during their lifetimes, but not even half of those who are unwell receive professional care. Czech Prime Minister Petr Fiala also mentioned that mental health care has long been one of the weakest areas of the Czech healthcare system. </p><p>In 2021, <a data-cu='"https://www.mzcr.cz/nova-epidemie-adolescenti-se-poskozuji/'" data-cwid='"1905341'" href='"https://www.mzcr.cz/nova-epidemie-adolescenti-se-poskozuji/'" target='"_blank'">research</a> showed that about 700,000 people in Czechia were diagnosed with a psychiatric issue. <a data-cu='"https://www.seznamzpravy.cz/clanek/ekonomika-b2b-i-akutni-pripady-cekaji-na-pomoc-mesice-system-psychiatricke-pece-kolabuje-232329'" data-cwid='"1905341'" href='"https://www.seznamzpravy.cz/clanek/ekonomika-b2b-i-akutni-pripady-cekaji-na-pomoc-mesice-system-psychiatricke-pece-kolabuje-232329'" target='"_blank'">According </a>to Peter Winkler, director of the National Institute of Mental Health, mental illness today accounts for roughly 15 percent of all domestic illnesses. Today, about one in 10 women and 6 percent of all men suffer from an anxiety disorder or depression.</p><p>The opening of the center at least partially alleviates Central Bohemia’s struggles with tackling mental health issues – the government and public will hope that future such facilities will open nationwide.</p>",inside-the-psychiatric-facility-photo-cdrakesocz-ssolw
