id_news,title,created_at,description,image_path
1e7947c7-3290-47fb-b287-7d2f0d0e1f9d,"News in brief for June 20: Thunderstorm and high-temperature warning issued across CzechiaThe top headlines for the Czech Republic on Tuesday, June 20, 2023, updated throughout the day to keep you up to speed.",2023-06-20 08:37:00,"<p>According to a <a data-cu='"https://cvvm.soc.cas.cz/cz/44-ostatni/vztahy-a-zivotni-postoje/5683-verejne-mineni-o-interrupci-eutanazii-a-prostituci-duben-kveten-2023'" data-cwid='"1905274'" href='"https://cvvm.soc.cas.cz/cz/44-ostatni/vztahy-a-zivotni-postoje/5683-verejne-mineni-o-interrupci-eutanazii-a-prostituci-duben-kveten-2023'" target='"_blank'">survey </a>conducted by the Czech Center for Public Opinion Research, the majority of Czech citizens support the freedom to choose regarding abortion and euthanasia.</p><p>Nearly 80 percent of respondents expressed support for a woman''s right to make decisions about terminating a pregnancy – the highest level since 1990. Just 2 percent called for a complete ban on abortion. Around 75 percent of Czechs favor the legalization of euthanasia, almost 20 percentage points more than in 2007. Additionally, four in 10 Czechs would support the legalization of prostitution as an official business.</p><p>After eight days on the loose, Děčín Zoo has announced that the last escaped monkey from its grounds has been safely captured. Last week, a group of nine monkeys broke free from their enclosure at the zoo, with six making it outside the premises.</p><p>The two-year-old escapee was spotted by two members of the public eating a watermelon, who then threw the fruit to lure and ultimately trap the macaque. Police announced earlier that they were looking for a person who had damaged the electric fence of the monkey enclosure after the zoo had closed for the day. Officers subsequently tracked down the suspect at a nearby restaurant.</p><p>President Petr Pavel has reacted to the announcement of Slovak counterpart Zuzana Čaputová to not stand for office again after her first term ends in June 2024. “Personally, I am very sad because we see the same meaning of freedom, peace, and promoting decency in politics. We will continue to fulfill the tasks for the benefit of our countries and I believe that we will build on this cooperation with her successor,'" Pavel said.</p><p>Čaputová, who turns 50 years old tomorrow, said that he did not believe she had enough strength to carry out another five-year presidential term. She was elected in 2019 and is the first-ever female Slovak president.</p><p>The U.S. embassy in Prague has announced that the U.S. will contribute USD 8.2 million (roughly CZK 178 million) to support refugees from Ukraine and organizations aiding them in Czechia. This funding is part of a larger aid package of over USD 107 million provided by the U.S. to European countries assisting individuals displaced by the Russia-Ukraine war. </p><p>The majority of the allocated funds will be utilized for essential necessities (USD 32.3 million), healthcare, and nutrition (USD 24 million), while approximately USD 10 million will be designated for protection, livelihoods, and socio-economic inclusion. </p><p>A burlesque dancer''s performance at the Rosé Wine Festival in Třebíč caused an uproar as children were present near the stage. Despite claims by the event organizer that the dancer''s nipples were covered and she didn''t remove her panties, a video of the event went viral, showing young children watching the striptease. </p><p>Child psychologist Michal Kniha told<a data-cu='"https://tn.nova.cz/zpravodajstvi/clanek/510017-slavnosti-lakaly-na-program-pro-nejmensi-deti-nakonec-videly-striptyz'" data-cwid='"1905205'" href='"https://tn.nova.cz/zpravodajstvi/clanek/510017-slavnosti-lakaly-na-program-pro-nejmensi-deti-nakonec-videly-striptyz'" target='"_blank'"> TV Nova </a>that while nudity may be natural, the concern lies in the fact that children were exposed to an event centered around alcohol. The festival organizer has faced backlash, with the city hall demanding a public apology and police launching an investigation.</p><p>Martina Navrátilová, <a data-cu='"https://www.expats.cz/czech-news/article/czech-born-tennis-great-navratilova-diagnosed-with-cancer'" data-cwid='"1905208'" href='"https://www.expats.cz/czech-news/article/czech-born-tennis-great-navratilova-diagnosed-with-cancer'" target='"_blank'">the Czech tennis legend</a>, has successfully overcome cancer after battling stage 1 laryngeal and recurring breast cancer. The 66-year-old former player shared the positive news after undergoing a series of tests in New York. Navrátilová expressed her gratitude to the medical professionals involved in her treatment.</p><p>The diagnoses were made after a lymph node in her neck swelled last November. In January, she announced that both findings were in the early stages and her prognosis for recovery was excellent. Navrátilová, who won 59 Grand Slam titles during her illustrious career, confirmed in March that the treatment had been effective and the cancer had receded.</p><p>Dita Charanzová, vice president of the European Parliament (EP) and member of the opposition Czech ANO movement, has stated in an online interview that she will not participate as a candidate for the ANO movement in the upcoming 2024 EP elections. Her decision stems from her disagreement with the current conservative and nationalist trajectory of the party. </p><p>She told a journalist that she is firmly against the way ANO leader Andrej Babiš conducted himself during the Czech 2023 presidential election and that “she could not explain it to colleagues [in Brussels].'"</p><p>A survey released today by NMS Market Research reveals that approximately 170,000 Czech children (aged eight to 15 years) are involved in “risky” online behavior. The study found that nearly 40 percent of children have '"online friends'" whom they have never met or know personally.</p><p>NMS notes that one in five Czech children experience cyberbullying, and over one-third of children said they shared photos or videos of themselves online. According to the survey, children spend on average three hours and 28 minutes a day on their mobile phones.</p><p>The Czech Hydrometeorological Institute (ČHMÚ) has today issued a high-temperature and thunderstorm <a data-cu='"https://www.chmi.cz/files/portal/docs/meteo/om/vystrahy/index.html'" data-cwid='"1905179'" href='"https://www.chmi.cz/files/portal/docs/meteo/om/vystrahy/index.html'" target='"_blank'">warning </a>for the vast majority of Czechia, including Prague, as the country anticipates temperatures of up to 34 degrees Celsius Wednesday. </p><p>The south and southwest of the country will see the highest temperatures, and on Wednesday afternoon – due to warm and humid air – strong storms will arrive from the west and will move across the country until Thursday night. A thundershower is predicted in the capital on Wednesday evening. According to the ČHMÚ, people “should expect strong thunderstorms” nationwide and be cautious of small floods.</p><p>President Petr Pavel and other speakers will commemorate the 30th anniversary of the Czech Republic at Prague Castle, emphasizing the significance of security for the country''s future. The Jagello 2000 association, dedicated to public diplomacy and security policy, aims to highlight the unique period of 30 years of sovereignty, freedom, and democracy in modern Czech history. </p><p>The association also emphasizes the historical challenges faced by the Czech Republic, including frequent interruptions of democratic development by totalitarian regimes and periods of occupation. A conference on security and a focus on the war in Ukraine precede the ceremony at the Castle.</p><p>The final farewell to a young Romani man, who was fatally stabbed by a 37-year-old foreigner during a fireworks display at the Ignis Brunensis festival near Brno Reservoir, will take place this afternoon in the ceremonial hall of the crematorium at Brno Central Cemetery. The funeral service will be followed by burial in the local cemetery. </p><p>The incident, involving a Ukrainian perpetrator, has sparked divided reactions within the Romani community. Romani figures and organizations emphasize that it is unfair to condemn the entire minority for the actions of one individual. The investigation is ongoing, and the suspect remains in custody following a court decision.</p><p>A tram chassis caught fire in Prague''s Zlíchov, leading to the interruption of tram services between Hlubočepy-Smíchovské nádraží. Firefighters are currently at the scene, and the Prague transport company has implemented a replacement bus service. The fire was caused by a technical fault, according to the transport company. </p><p>Traffic in the vicinity of Zlíchov is severely affected, and tram services and bus schedules may experience disruptions. Commuters are advised to use alternative transportation options.</p><p>Cheb District Court ruled in favor of Steffen Schlegel, a former East German citizen, who attempted to cross the Czechoslovak border into West Germany in 1989 and was detained and shot by border guards before being handed over to the East German secret service. The court allowed Schlegel to apply for compensation, which would only amount to a few hundred crowns.</p><p>Schlegel''s lawyer argued that the border protection system violated international conventions. Ironically, a few days after Schlegel was detained, East German citizens were granted permission to emigrate to West Germany through the embassy in Prague.</p><p>In the first quarter of this year, banks and savings banks in the Czech Republic experienced a decline in aggregate net profit, falling by CZK 2.4 billion compared to the previous year to CZK 21.12 billion, according to the Czech National Bank. Bank assets, however, increased by CZK 840 billion to reach CZK 9.745 trillion by the end of March. </p><p>The introduction of a windfall tax, which imposes a 60 percent tax surcharge on excessive profit for the six largest banks, may have contributed to the decrease in profit. Analysts suggest that the state''s tax collection from the banking sector may be lower than initially anticipated.</p>",illustrative-image-istock-mdesigner125-acxuh
c35907c7-852d-4079-a584-6b8b7ba78bc8,New Zealand rugby team honors 30 years of Czech-Kiwi diplomacy with haka dance at Prague CastleThe New Zealand Ambassador's team will compete against the Czech rugby team on Wednesday in Prague.,2023-06-20 08:29:00,"<p>The New Zealand Ambassador''s rugby team, gearing up for their match against Czechia on Wednesday, treated President Petr Pavel to a mesmerizing display of the traditional Maori haka dance in the South Gardens of Prague Castle Monday. In his address to the New Zealand athletes, Pavel praised the values embodied by rugby, emphasizing their significance beyond the realm of sports.</p><p>Originating as a warrior ritual before battles, the haka dance has become a cherished tradition for New Zealand rugby players, performed before every international match. It features an immersive blend of rhythmic chants, shouts, gestures, and fierce expressions.</p><p>The president mused that this was likely the first-ever haka performance at Prague Castle. He received jerseys from both teams, who are set to showcase their skills in an exhibition match on Wednesday at 6:00 p.m. at the <a data-cu='"https://www.rugbyunion.cz/novinky/tatra-smichov-chysta-svatek-ragby-fanousci-uvidi-haku-novozelandany-i-ceskou-reprezentaci'" data-cwid='"1905014'" href='"https://www.rugbyunion.cz/novinky/tatra-smichov-chysta-svatek-ragby-fanousci-uvidi-haku-novozelandany-i-ceskou-reprezentaci'" target='"_blank'">Tatra Smichov complex</a>.</p><p>Jaroslav Zajíček, director of the Presidential Office foreign affairs department, said, '"The New Zealand Ambassadors team approached the Presidential Office to inquire about the possibility of dancing here. The aim is to convey a message of courage, which resonates strongly with the president. Moreover, it serves as a testament to the excellent relations between the Czech Republic and New Zealand.'"</p><p>The occasion also held significance as it marked the 30th anniversary of diplomatic ties between the two nations.</p><p>Zajíček added, '"In my view, rugby in New Zealand, and football in our country, for instance, possess a remarkable ability to transcend barriers and become integral parts of our respective cultures.'" He added that he considered it '"not just a sporting endeavor but also a form of sports diplomacy,'" which made the performance at Prague Castle '"such a momentous occasion.'"</p>",photo-via-petr-pavefacebook-scfwg
afc3e9ce-2839-4232-b994-df70691b9029,"Czech government''s new campaign aims to improve communication with publicCalled ''Czechia informs,'' the new web page will display information regarding updated laws and offer advice to citizens.",2023-06-20 07:30:00,"<p>The government has announced the launch of its new communication campaign – named “<a data-cu='"https://portal.gov.cz/kam-dal/cesko-informuje'" data-cwid='"1904923'" href='"https://portal.gov.cz/kam-dal/cesko-informuje'" target='"_blank'">Czechia informs</a>” – to help better inform and educate citizens about any governmental or legal changes that will affect people’s daily lives. It will take the form of a web page on the existing gov.cz portal.</p><p>According to the head of Czechia’s Department of Strategic Communications Pavel Lupjan, the main goal of the campaign '"is to improve the awareness of people in the Czech Republic'" as well as '"people’s quality of life,'" <a data-cu='"https://www.idnes.cz/zpravy/domaci/vlada-komunikacni-kampan-cesko-informuje-medialni-prostor-miliony-korun.A230619_125335_domaci_vank'" data-cwid='"1904924'" href='"https://www.idnes.cz/zpravy/domaci/vlada-komunikacni-kampan-cesko-informuje-medialni-prostor-miliony-korun.A230619_125335_domaci_vank'" target='"_blank'">iDnes.cz</a> quotes him as saying.</p><p>In addition to being updated with new changes, the site will also allow people to search through past laws that have been implemented or amended. At present, it also offers advice on child-welfare payments, vaccination against tick-borne encephalitis, the New Green Savings Program, as well as other topics. The page is currently only available in Czech, but can be translated into English.</p><p>It cost the state over CZK 20 million to set up and will be active until at least the end of 2023. This move ties in with President Petr Pavel’s wish to improve state-public communication by informing the public more frequently about changes to the legislature. </p><p>The change is also connected to the country’s digitization efforts – in January the government approved a proposal to bring all state administrative websites under one single domain – gov.cz. This page also offers various different information and guidance to the public, and is available in <a data-cu='"https://gov.cz/en'" data-cwid='"1904930'" href='"https://gov.cz/en'" target='"_blank'">English</a>.</p><p>A March 2023 <a data-cu='"https://cvvm.soc.cas.cz/cz/tiskove-zpravy/politicke/instituce-a-politici/5653-hodnoceni-vlady-petra-fialy-unor-brezen-2023'" data-cwid='"1904931'" href='"https://cvvm.soc.cas.cz/cz/tiskove-zpravy/politicke/instituce-a-politici/5653-hodnoceni-vlady-petra-fialy-unor-brezen-2023'" target='"_blank'">survey from Czechia’s Center for Public Opinion Research</a> found that 66 percent of all Czechs were “dissatisfied” with the government’s level of communication with the public. </p><p>'"If I had to criticize the current government, it would primarily be the way it communicates. They don''t consider it that important – they kind of ignore it,” said political scientist Vít Hloušek Brno’s Masaryk University in <a data-cu='"https://www.irozhlas.cz/zpravy-domov/fialova-vlada-konsolidacni-balicek-uspory-komunikace-duchodova-reforma_2305110645_jgr'" data-cwid='"1904932'" href='"https://www.irozhlas.cz/zpravy-domov/fialova-vlada-konsolidacni-balicek-uspory-komunikace-duchodova-reforma_2305110645_jgr'" target='"_blank'">iRozhlas.cz</a>. Similarly, political Petr Just from Metropolitan University Prague has described the government’s public communication as its “Achilles'' heel.”</p><p>Too, although its Council of EU presidency last year was seen as largely successful, the government’s downfalls came in its communication. '"Unfortunately, the government did not use the potential of the presidency in the context of communicating European affairs to the public,” analyzed <a data-cu='"https://denikn.cz/1037339/hlavni-uspech-predsednictvi-v-rade-eu-cesko-vyrostlo-a-snad-se-konecne-zbavilo-sveho-mindraku/#:~:text=%C4%8Cesko%20kr%C3%A1tce%20p%C5%99ed%20p%C5%99edsednictv%C3%ADm%20zm%C4%9Bnilo,potravin%20a%20dal%C5%A1%C3%ADch%20kl%C3%AD%C4%8Dov%C3%BDch%20komodit.'" data-cwid='"1904933'" href='"https://denikn.cz/1037339/hlavni-uspech-predsednictvi-v-rade-eu-cesko-vyrostlo-a-snad-se-konecne-zbavilo-sveho-mindraku/#:~:text=%C4%8Cesko%20kr%C3%A1tce%20p%C5%99ed%20p%C5%99edsednictv%C3%ADm%20zm%C4%9Bnilo,potravin%20a%20dal%C5%A1%C3%ADch%20kl%C3%AD%C4%8Dov%C3%BDch%20komodit.'" target='"_blank'">Deník N</a> in December.</p><p>The government will hope the new site increases its popularity among the public and boosts its performance in an aspect it is much-criticized in.</p>",illustrative-image-istock-natatravel-qvled
4d6afb87-73e7-4069-bacd-549e55a4e213,"Prague’s biggest music and arts festival takes place this weekNew relaxation zones, more culinary options, a simpler cashless system, and an expanded side program are a few of this year''s changes.",2023-06-19 16:00:00,"<p>Metronome Prague, the city’s biggest annual music and arts event, starts this Wednesday, June 21, and runs until June 24 at Výstaviště Holešovice. The sixth edition of the festival will bring international music stars, a podcast festival, a program for the whole family, enhanced public transportation, and a new comfort zone.</p><p>The first day will be a bit of a preview event, with just two bands – the Queens Orchestra from Ukraine and Czech music star David Koller. Queens Orchestra, composed of 17 women, will be in Prague for the first time. They play jazz, rock, and modern interpretations of classical music. They hope to use culture to remind people that the conflict in Ukraine is still going on. </p><p>David Koller has also been active in supporting Ukraine and has personally participated in humanitarian work. He recently released an album of new material. Tickets to the first evening are separate from the main festival tickets.</p><p>The <a data-cu='"https://www.expats.cz/czech-news/article/jamiroquai-zaz-headline-metronome-prague-festival'" data-cwid='"1904885'" href='"https://www.expats.cz/czech-news/article/jamiroquai-zaz-headline-metronome-prague-festival'" target='"_blank'">main part of the festival</a> takes place June 22 to 24 on <a data-cu='"https://www.metronome.cz/en/info'" data-cwid='"1904885'" href='"https://www.metronome.cz/en/info'" target='"_blank'">seven stages</a> and will feature 80 performances. Acts include big names from both the international and domestic music scenes, such as Jamiroquai, ZAZ, Moderat, Aurora, M83, Editors, Tove Lo, J.I.D, White Lies, Kelvyn Colt, Frosti, Jana Kirschner, Zrní, Midi Lidi, Supercrooo, PSH, and more. Over 25,000 people are expected to attend.</p><p>“This year''s edition is the most prepared we''ve ever been, and it will run exactly as we originally envisioned,” festival co-organizer David Gaydečka, said, adding that there will be some surprises as well.</p><p>Organizers have continued to fine-tune the gastronomy, services, facilities, and accompanying activities. Refreshments will be in two zones with a more varied international selection of food than for the previous editions, plus beer from Pilsner Urquell and the Proud brewery in Vinohrady, and of course Czech and imported wine and non-alcoholic beverages.</p><p>Payment will again be cashless, but people won’t need to get special chip bracelets, which complicated purchases in the past. Standard credit or debit cards, smartphones, and smartwatches can be used.</p><p>In the Škoda Auto chill-out zone, people can charge mobile phones while relaxing at charging stations. Next to that area, a new comfort zone was created in partnership with mobile operator T-Mobile. The comfort tickets allow for faster entry to the festival through additional entry points and let people use a partly covered comfort zone that offers 20 percent off on beverages. T-Mobile customers can get comfort zone tickets at a discount.</p><p>Metronome Prague will not only be about music. The accompanying program includes outdoor art installations, exhibitions, an adventure escape game, workshops, film and theater productions, a sports zone, a cache hunt, and a hip-hop dance school. A children''s program includes theater, dance, and art workshops, a skatepark, a photo corner, and other entertainment.</p><p>One of the biggest draws will undoubtedly be a unique realization of the iconic Alien sculpture by artist H.R. Giger, which Metronome has prepared in cooperation with the Aleš South Bohemian Gallery. Another is podcasters who will be recording their festival specials, and in some cases allowing people to join in on the debate.</p><p>The Czech Olympic Committee is preparing a special zone about courage, dedicated to Czechoslovak gymnast Věra Čáslavská. There will also be space for non-profit organizations to share their current projects.</p><p>People will also be able to support the children''s charity project <a data-cu='"https://www.pomoztedetem.cz/'" data-cwid='"1904912'" href='"https://www.pomoztedetem.cz/'" target='"_blank'">Pomozte dětem</a> (Help the Children) by donating back the deposit on returnable beverage cups. The symbol of the charity is Kuře, a baby chicken. The mascot will be present at the festival. The project helps children with medical disabilities, socially excluded children, and children who are at risk from their surroundings.</p><p>Due to very limited parking space, people are urged to use public transit to get to the festival site. Tram service to the area will be strengthened. The venue is also a 15-minute walk from the Nádraží Holešovice metro stop. Complete information about tickets, the performance lineup, and other practical details can be found on the <a data-cu='"https://www.metronome.cz/en'" data-cwid='"1904893'" href='"https://www.metronome.cz/en'" target='"_blank'">festival website</a>.</p>",audience-at-last-years-metronome-festival-photo-metronome-wwqva
