id_news,title,created_at,description,image_path
7382e6e1-564f-45a7-b525-d7ffab0c4e1e,"PHOTO GALLERY: Štvanická footbridge undergoes final stress testsThe bridge linking Holešovice and Karlín will open to the public in July, once it is certified as safe.",2023-06-23 13:54:00,"<p>The footbridge connecting Holešovice with Karlín via Štvanice ostrov is completed and now undergoing tests before it can open to the public later this summer. Bridge specialists from construction firm Skanska loaded the 300-meter-long structure with trucks and then rocked it in a controlled manner to simulate its extreme load.</p><p>'"At last, we are entering the final stage with the construction of the Štvanická footbridge. If all load tests go well, the footbridge will open to the public in July,'" Prague Deputy Mayor Zdeněk Hřib, responsible for transportation, said in a press release.</p><p>'"The Štvanická footbridge is a truly unique structure, both in terms of construction and the materials used. Many things on the construction site are completely new even from the point of view of very experienced builders,'" Hřib added.</p><p>The new bridge has long been nicknamed HolKa – a portmanteau of Holešovice and Karlín, the two neighborhoods that it will connect. Holka is the Czech word for '"girl.'" Construction is complete, a railing with lighting has been installed, and work is being done on the connection to the surrounding roads and landscaping.</p><p>'"By putting the footbridge into operation, we will make the journey more pleasant and shorter for many Prague residents and visitors. So let''s keep our fingers crossed for the construction experts until the final finish,'" Hřib said.</p><p>Skanska project manager Michal Kunc said static tests used trucks with a total weight of over 70 tons, and dynamic tests used vibration exciter with a half-ton weight. '"We will use the data from both tests to precisely set the vibration dampers that will be built into the footbridge. Immediately after the tests, we will also start with the final treatment of the surfaces,'" Kunc said.</p><p>Petr Tej, one of the bridge’s architects. said the static and dynamic load tests are the last milestone before putting the footbridge into operation. '"From Prague''s point of view, this will create an essential link between Holešovice and Karlín,'" Tej said, adding that the project '"is mainly a continuation of the ongoing reconstruction of Bubenské nábřeží in Holešovice, the connection to the A2 cycle path in Karlín and the ongoing recultivation of part of Štvanice ostrov.'"</p><p>The new bridge will save people a significant amount of travel time. Going from riverside hangout Přístav 18600 to <a data-cu='"https://www.expats.cz/czech-news/article/future-look-for-prague-market-revealed'" data-cwid='"1906106'" href='"https://www.expats.cz/czech-news/article/future-look-for-prague-market-revealed'" target='"_blank'">Pražská tržnice</a> (Prague Market) will become a five-minute walk instead of a journey involving two public transport vehicles.</p><p>Construction of the white ultra-high-quality concrete bridge began in January 2022. The walking width is four meters, and three meters at the ramp to Štvanice Island. The bridge will be lit by LED strips hidden in the handrail, so there will be no unnecessary light pollution.</p><p>The project was originally <a data-cu='"https://www.expats.cz/czech-news/article/pedestrian-bridge-between-prague-s-holesovice-and-karlin-districts-to-be-functional-by-2022'" data-cwid='"1906108'" href='"https://www.expats.cz/czech-news/article/pedestrian-bridge-between-prague-s-holesovice-and-karlin-districts-to-be-functional-by-2022'" target='"_blank'">announced in 2020</a> with an opening date of 2022, but it faced several delays due to the pandemic and other factors. Bridge safety became an issue when a footbridge to Prague Zoo collapsed in 2017. It has since<a data-cu='"https://www.expats.cz/czech-news/article/footbridge-to-prague-s-troja-district-undergoing-testing-to-open-in-october'" data-cwid='"1906108'" href='"https://www.expats.cz/czech-news/article/footbridge-to-prague-s-troja-district-undergoing-testing-to-open-in-october'" target='"_blank'"> been replaced </a>with another one, and several other Prague bridges and overpasses are<a data-cu='"https://www.expats.cz/czech-news/article/future-look-of-prague-s-cubist-style-liben-bridge-revealed'" data-cwid='"1906108'" href='"https://www.expats.cz/czech-news/article/future-look-of-prague-s-cubist-style-liben-bridge-revealed'" target='"_blank'"> being reinforced</a>.</p>",stress-test-on-the-holka-footbridge-photo-skanska-eeist
7be818a7-3b97-4f5c-9a5e-7ce091e62753,"A slice of excitement: Domino''s opens first-ever Prague branchCurrently operating from Nusle, Prague 4, the famous US firm is planning to open a new store later this year.",2023-06-23 12:06:00,"<p>The world’s largest pizza chain by revenue, Domino’s, ceremonially opened its doors for the first time in Prague Thursday afternoon. The 63-year-old U.S. chain has high ambitions and plans to expand its network in the capital this year.</p><p>Based on a busy street in Nusle, the chain will prepare all of its pizzas and ingredients in-store using locally sourced products, ensuring that everything is as fresh as possible.</p><p>“We want to be the best in delivery…we have a 25-minute goal of completing orders, and the pizza should arrive with a heat of 70 degrees Celsius,” said Eugenio Becerro, the managing director of Daufood (linked with Domino''s) for Greece and Central Europe, at the opening. Quality, he says, is imperative.</p><p>Luis Garcia, the director of marketing for Domino’s Prague, told Expats.cz that the store will not use any food-delivery firms (such as Wolt, foodora, or Bolt Food) during the opening months.</p><p>“We want to ensure a strong relationship with our customers and community at the start, that’s why we want to take care of deliveries ourselves,” Garcia said. He pointed out that Domino’s is very much a neighborhood-centered branch. </p><p>Garcia also explained that, by using this method, fewer delays and hold-ups are expected. The focus, he explains, is to make a gradual entry into the Prague market – this will also help to avoid overburdening the staff that cook and prepare the pizza at the store.</p><p>The firm, however, does plan to cooperate with food-delivery companies later on. For now, orders can be placed via the app, online, or by simply calling. You must live within a specific delivery area in order to get your food, otherwise, you’ll need to collect it at the Nusle store.</p><p>At present, delivery costs CZK 39, and Domino''s interestingly charges a so-called box fee. You''ll pay CZK 15 for a large-pizza box, and CZK 10 for a medium one. A starter or side also comes with a CZK 10 box fee. A medium (29 centimeters) Margherita pizza costs CZK 199, and a large (36 cm) is CZK 259. Stuffed (cheesy) crust costs an extra CZK 49.</p><p>A serving of potato wedges is charged at CZK 59 and a small brownie for dessert is CZK 49. For liquid refreshments, a 0.33-liter can of Coca-Cola costs CZK 35, and Domino''s even sells beer (0.5 liters of Gambrinus), which costs CZK 45. A full list of pizza and other food prices can be found on the <a data-cu='"https://www.dominospizza.cz/menu/nuselska#pizzas'" data-cwid='"1906094'" href='"https://www.dominospizza.cz/menu/nuselska#pizzas'" target='"_blank'">website</a>.</p><p>This is a first for Prague, but not for Czechia. </p><p>In 2019, Domino’s opened its maiden Czech branches in Brno. Since then, one has closed, but the other is performing well – strongly enough to prompt an expansion to the capital.</p><p>The Brno branches, which were pilots, opened in Czechia’s second-largest city not only to gauge demand but also because of its proximity to Austria. “We opened in Brno because it strategically made a lot of sense. We were able to source many ingredients and items from Austria, which is nearby and has a strong Domino’s presence,” Garcia explains.</p><p>Garcia interestingly also explained that, despite its fame, Domino''s is not known by many Czechs. He wants to change that via online and in-person marketing.</p><p>What about the future? If all goes well, Nusle will be one of several Domino’s branches in Prague. And the company has big aspirations: it plans to open a branch near the capital’s very busy I.P. Pavlova area later this year and has eyes on other (undisclosed – sorry!) locations in the near future.</p><p>“We plan to connect all of Prague’s Domino’s chains together so that they cooperate with one another,” Garcia says, which will broaden the company’s delivery areas and should ultimately make deliveries speedier. </p><p><a data-cu='"https://www.dominospizza.cz/'" data-cwid='"1906077'" href='"https://www.dominospizza.cz/'" target='"_blank'">The website</a> is readily available in English and also includes the current average delivery time and a real-time tracker of when your pizza will arrive. </p><p>To mark its opening, the firm is offering several deals such as buying two pizzas and getting one free. Various types of pizza are on offer, including: kebab pizza; chicken burger pizza; BBQ bacon; cheeseburger pizza; and diavola. You can also “build your own pizza” or try the “half-half” option, which allows you to try two types in one.</p><p>The pizza is of a typical U.S. style with thicker crusts – you can also choose to stuff your crusts. Alternatively, Domino''s also offers an '"Italian style'" pizza, for those who prefer thinner crusts. Sides include stuffed cheesy bread, potato wedges, breadsticks, chicken wings, and more.</p><p>The opening of the Domino’s branch will not only please fans of traditional U.S. pizza, but may also significantly disrupt the pizzeria industry in Prague – Pizza Hut, which has three chains in Prague, may be looking over its shoulder.</p><p>Bustling with people following its launch, the renowned firm will hope that the Nusle branch is one slice of many, future successes – something Domino’s is evidently hungry for.</p>",the-opening-of-the-nusle-store-on-june-23-2023-photo-twitterusembassypragu-gkauu
b594e4cb-b12d-42b8-9190-0cae923c28ec,Festival organizers return subsidy after video of kids at burlesque show goes viralPolice are investigating whether a burlesque performer's act witnessed by pre-teen children qualifies as a crime.,2023-06-23 10:07:00,"<p>The organizers of the Rosé Wine Festival, where a burlesque performer did her act in front of small children, have agreed to return a CZK 60,000 subsidy to the town of Třebíč. An apology was posted on social media, but the main organizer blames the person who posted the video that went viral for the negative fallout. Police are investigating the case to see if it qualifies are a crime.</p><p>The video shows <a data-cu='"https://www.facebook.com/elektrashow/'" data-cwid='"1906054'" href='"https://www.facebook.com/elektrashow/'" target='"_blank'">burlesque performer ElektraShow </a>kneeling in a large glass cup, removing her bra to show tassels on her breasts, and then throwing confetti while jazz music plays. The audience in front of the outdoor stage seems to be exclusively pre-teen children. The festival took place on June 17 on the grounds of the Třebíč chateau in the Vysočina region of the Czech Republic.</p><p>'"We want to apologize to everyone who came to Saturday''s ninth Annual Rosé Wine Festival and left bitter about the program, specifically the burlesque performance. We understand the reactions of parents, who were at the festival together with their children, and we accept full responsibility for the mistakes that happened – such as, for example, the inappropriate timing of this performance on the program,'" a post on the<a data-cu='"https://www.facebook.com/slavnostiruzovehovina/posts/pfbid02EPyxtQYjmwQqdxXaj6Wv4k1m5pLNQ4b4ybRWHEwzrK4NF3H5uoicCPG4LZYKZXCfl'" data-cwid='"1906055'" href='"https://www.facebook.com/slavnostiruzovehovina/posts/pfbid02EPyxtQYjmwQqdxXaj6Wv4k1m5pLNQ4b4ybRWHEwzrK4NF3H5uoicCPG4LZYKZXCfl'" target='"_blank'"> festival’s Facebook page</a> said.</p><p>'"According to an agreement with the city, which did not participate in the program in any way, we will return the subsidy in the amount of CZK 60,000, which was provided to us for organizing the festival. We are sorry that this vintage left such a bitter aftertaste, it is a lesson for us for the next years. We will take the tenth Jubilee Rosé Wine Festival, which awaits us next year, in a more sober spirit,'" they added.</p><p>Event organizer Aleš Mejzlík told CNN Prima News that the town had asked for an apology. He added that he now considers the case closed, but is unhappy about the scandal caused by the public posting of the video. '"I sense that the lady who put it there might apologize. What all the media started was completely unnecessary,'" Mejzlík said.</p><p>But the case might just be starting. The police will announce in the coming days whether the incident was a misdemeanor or a crime. The parents who allowed their children to watch the adult-oriented performance could bear some of the blame.</p><p>Performer ElektraShow claims said the whole incident could have been avoided if the parents paid attention. '"The moment I went on stage, I heard the presenter warn the audience that the performance was not really suitable for children,'" she said, according to <a data-cu='"https://www.lidovky.cz/domov/trebic-vysocina-burleska-slavnosti-ruzoveho-vina-deti.A230622_162900_ln_domov_rkj'" data-cwid='"1906059'" href='"https://www.lidovky.cz/domov/trebic-vysocina-burleska-slavnosti-ruzoveho-vina-deti.A230622_162900_ln_domov_rkj'" target='"_blank'">news site Lidovky.cz</a>.</p><p>The performer was aware of the children but felt pressured into continuing with her act. She told <a data-cu='"https://www.echo24.cz/a/HE7s4/zpravy-domov-chtela-jsem-vystoupit-pozdejsi-hodiny-mohou-za-to-poradatele-a-rodice-tvrdi-burlesque-tanecnice-trebic'" data-cwid='"1906060'" href='"https://www.echo24.cz/a/HE7s4/zpravy-domov-chtela-jsem-vystoupit-pozdejsi-hodiny-mohou-za-to-poradatele-a-rodice-tvrdi-burlesque-tanecnice-trebic'" target='"_blank'">news server Echo24</a> that parents ignored the warning to remove the children. “The whole situation was very uncomfortable for me and I was under the pressure of circumstances, such as a penalty in the contract for a canceled performance, and it was about maintaining professionalism and doing the work for which I was paid,” ElektraShow said.</p><p>She added that before signing the performance contract, she provided the organizer with an accurate description of the show and a video recording of the performance, stating that it was not suitable for children. She was assured that the children would be in a separate space. '"Knowing that it is an event for adults where alcohol is consumed, I really did not expect such a large participation of children,'" ElektraShow said.</p>",performer-elektrashow-at-a-nightclub-performance-photo-facebook-dmosd
5e401dfc-67b3-4d55-ad97-8cb3ce0f9a26,"News in brief for June 23: Czechia, EU countries call for faster Western Balkans accession to EUForest dog puppies born at Prague Zoo, Czech Radio still impacted by attack, storms weaker than expected, and more top stories.",2023-06-23 09:06:00,"<p>The Czech Senate has announced today that on July 13 it will vote on the U.S.-Czechia Defense Cooperation Agreement, with discussions to begin next week. </p><p>The treaty, approximately 40 pages, encompasses various topics that relate to potential U.S. troop presence in Czechia and cooperation between the US and Czech armed forces on Czech territory in case of an emergency. Minister of Defense Jana Černochová promised earlier this year that the agreement would not permit the establishment of a U.S. military base on Czech soil.</p><p>The government has today agreed to increase the parental allowance by CZK 50,000, to a total of CZK 350,000. However, the allowance must now be utilized within three years (rather than the current four). </p><p>If passed, the law amendment will come into force at the beginning of 2024. The coalition is currently deciding if the law will only apply to children born after Jan. 1, 2024, or whether it will be retroactive. Last year, parental allowance cost the state CZK 33 billion.</p><p>President Petr Pavel today nominated deputy president of the Municipal Court in Prague Veronika Křesťanová to become a new Constitutional Court judge. </p><p>Křesťanová expressed her gratitude for the nomination, considering it a significant recognition of her previous work, particularly in the fields of personality protection, copyright, and media law – subjects she specializes in. Her notable cases include examining the authorship of former President Václav Klaus'' amnesty text and – recently – ruling on a nurse''s claims against a media publisher for disregarding the presumption of innocence.</p><p>The websites of Czech Radio – Rozhlas.cz and iRozhlas.cz – have been operating in a limited mode since a hacker attack on Thursday evening, according to the company. While textual content remains intact, only a portion of the audio and images that had been stored on the compromised disk arrays in the data center are accessible. </p><p>Czech Radio spokesperson Jiří Hošna stated that they are actively working to restore functionality by migrating images from their platform and seeking data from external sources. It is uncertain how long this will take. Technical details and the identity of the attacker remain undisclosed pending investigation. The attack was believed to be linked to a media and Ukraine conference, with the intention of disabling public media web services.</p><p>The PPF Group, a Czech-founded global investment firm, announced today that it is considering the acquisition of Packeta, including its subsidiary Zásilkovna, a logistics company in the Czechia. PPF CEO Jiří Šmejc stated that he would only be interested in acquiring the entire company. Packeta saw a 23-percent increase in turnover to CZK 6.1 billion in 2022. </p><p>Shipments rose by 25 percent to nearly 90 million, and the company operated over 15,000 delivery points across four countries. Packeta aims to sustain double-digit sales growth in the upcoming years. Founders, along with other stakeholders, announced Packeta''s availability for sale in May.</p><p>Prague has received a new delivery of spare parts and components for modern, U.S. H-1 system military helicopters, which will replace the outdated Soviet Mi-24V/35 models in the Czech army. State enterprise LOM Praha, which will service the choppers, confirmed the news today.</p><p>The Defense Ministry will allocate approximately CZK 1.3 billion for servicing until 2030. Czechia is purchasing an additional eight Venom helicopters and four Viper fighters, while also receiving six used Vipers and two Venoms as a gift from the U.S. for aiding Ukraine in the face of Russian aggression.</p><p>At an EU foreign ministers’ meeting in Austria today, the foreign affairs ministers of Czechia, Austria, Slovakia, Slovenia, Croatia, Greece, and Italy called for a faster EU enlargement process for the Western Balkans. They emphasized the need for accelerated integration with concrete steps to be taken from 2024 onwards.</p><p>The ministers expressed concerns about the slow and bureaucratic nature of the enlargement process, which has resulted in disillusionment and alienation among the people of these countries – particularly the youth. They also highlighted the threat posed by Russia''s aggression against Ukraine to both the EU and the Western Balkan countries. Candidates for EU membership in the Western Balkans are Bosnia and Herzegovina, Serbia, Montenegro, North Macedonia, and Albania.</p><p>According to a recent <a data-cu='"https://www.median.eu/cs/?p=3130'" data-cwid='"1906029'" href='"https://www.median.eu/cs/?p=3130'" target='"_blank'">survey by the Median agency</a>, the current government coalition parties would not secure a majority in the Chamber of Deputies elections. ANO movement leads with 34.5 percent voter preferences, followed by ODS (15 percent), Pirates (10.5 percent), and SPD (8.5 percent).</p><p>The coalition parties have a combined support of 41 percent and would win 92 parliamentary seats, falling short of a narrow majority by nine votes. The survey was conducted online and through household visits from May 1 to June 2, 2023, with 1,012 respondents. Dissatisfaction with democracy functioning was also highlighted in an Ipsos survey.</p><p>Heavy thunderstorms in the Czech Republic brought relief from the recent hot weather. Despite initial concerns, the storms turned out to be milder than expected. Precipitation totals were high in some areas, causing fallen trees and localized damage. However, the storms primarily affected Germany and reached the Czech Republic later at night. </p><p>Train services faced interruptions due to damaged traction lines and security equipment. The storms gradually subsided, and cooler temperatures were forecasted for the weekend. Wednesday''s storms had already caused disruptions, with wind gusts and lightning strikes leading to damage and power outages in some areas.</p><p>Prague Zoo celebrated the birth of bush dog puppies after a five-year hiatus. The pair of cubs, born on April 8, are the first offspring of a newly introduced breeding pair of these challenging-to-breed wild dogs. Visitors have not yet been able to see the puppies as bush dogs are sensitive while raising their young.</p><p>The zoo confirmed that people can now observe the puppies in the outdoor enclosure of the small American carnivores area. Bush dogs, native to Central and South America, are threatened by habitat loss, declining prey, and disease transmission. The species is categorized as near threatened on the IUCN Red List.</p><p>Prague criminal investigators have released footage of the suspects, a group of five men, who assaulted a foreigner in Prague on December 28 in Prague''s Old Town. The attack left the victim permanently injured and blinded in one eye. Authorities have released CCTV footage of the suspects, urging the public to come forward with any information. </p><p>The police spokesperson emphasized that the consequences of the attack were severe, and the victim''s vision loss was irreversible. The investigation is focused on charges of disorderly conduct and bodily harm, carrying a potential prison sentence of up to eight years.</p><p>PPF Group incurred significant costs in leaving Russia after the Ukraine invasion, amounting to hundreds of millions of euros. Despite this, the group would have had higher profits last year than pre-pandemic levels if not for the Russia-related expenses, according to PPF Director Jiří Šmejc. PPF reported a net profit of €140 million in 2022, a 49% decrease from the previous year, while assets declined by 5.5% to €39.9 billion. </p><p>Šmejc emphasized the importance of leaving Russia quickly, stating that principles outweighed financial gains. PPF''s investment strategy will continue to focus on telecommunications, media, financial services, and e-commerce, with an emphasis on influencing long-term company outcomes.</p>",illustrative-image-istock-sinonimas-xmkqi
