id_news,title,created_at,description,image_path
d575bc24-9112-4512-b213-4a16495e9244,"Czechia takes step toward tightening ban on politicians'' media ownershipIf passed, the updated law will prevent members of parliament from broadcasting and publishing print and online news.",2023-06-16 13:20:00,"<p>The Czech Chamber of Deputies has this afternoon passed an amendment to the country’s conflict-of-interest law, aiming to tighten regulations on media ownership and the allocation of subsidies and investment incentives to politicians.</p><p>Dubbed '"lex Babiš'" in reference to former Prime Minister Andrej Babiš’s vast media ownership, the amendment prohibits politicians from transferring media assets to close associates or trust funds. It also introduces higher fines for violations of these rules. </p><p>Babiš owns the <a data-cu='"https://www.mafra.cz/o-spolecnosti.aspx'" data-cwid='"1904430'" href='"https://www.mafra.cz/o-spolecnosti.aspx'" target='"_blank'">MAFRA </a>publishing group, which includes Mladá Fronta Dnes (iDnes.cz online) Lidové noviny (Lidovky.cz), and the Metro online publications. The total readership of MAFRA titles is 4.83 million readers, which represents 55 percent of the population in the Czech Republic aged 12-79 years.</p><p>Despite facing opposition from the senior opposition ANO movement, led by Babiš, the lower house passed the amendment with a slim majority, securing 85 votes from the 164 members of parliament (MPs) present. MPs from all current coalition parties supported the amendment, whereas politicians from the ANO and Freedom and Direct Democracy parties voted against it. If the amendment receives final approval from the Senate and President Petr Pavel, it will take effect next year.</p><p>Once implemented, the amendment will extend conflict-of-interest regulations to the president, requiring annual submission of asset declarations and imposing restrictions on media ownership. It primarily aims to prevent MPs, senators, government officials, and the president from broadcasting and publishing periodicals. </p><p>To prevent circumvention, the ban will apply to the actual owner of the media operator, not just the person who controls it. Furthermore, companies linked to politicians will be prohibited from receiving subsidies and investment incentives.</p><p>While the amended rules impose stricter regulations, there are specific exemptions for the media. Political parties, their institutes, or affiliated companies will be allowed to publish periodicals without falling under the ban. Media operators not required to issue annual financial reports will also be exempt.</p><p>To deter violations of the media operation ban, the amendment proposes fines for offenders. Officials found guilty of the offense through a company could face fines of up to 3 percent of the company''s assets. The relevant authority will take appropriate measures, such as selling the media outlet, before imposing fines.</p><p>Politicians affected by the new media regulations will have a 60-day deadline to respond to the amendment. ANO MPs and Babiš have said that the new amendment is an unfair attack on the billionaire.</p>",former-prime-minister-andrej-babis-has-been-cleared-over-subsidy-fraud-chargers-uunwu
ba7703b2-f13a-4847-a4ac-4a7624946afa,"QUIZ: Do you know your Czech palaces, castles, and chateaus? Test yourself!Summer is the best time of the year to explore the historic fortifications and fairy-tale palaces in one of Europe''s most castle-dense nations.",2023-06-16 12:00:00,"<p>Around 3.7 million people visited Czech castles in 2022, <a data-cu='"https://www.expats.cz/czech-news/article/the-daily-dozen-12-things-to-know-about-czechia-today-18'" data-cwid='"1904343'" href='"https://www.expats.cz/czech-news/article/the-daily-dozen-12-things-to-know-about-czechia-today-18'" target='"_blank'">according to data</a> from the National Monuments Institute. The summer months are the most popular time for visiting a castle in the Czech Republic. The castles in this quiz represent some of the most visited castles and chateaus in the land. How many have you been to and which ones can you name on sight?</p>",illustrative-image-of-pernstejn-castle-photo-by-artrush-chimn
bb4748a4-ec23-42f9-9d2e-e45aa45edb9a,"Launch date announced for Prague-Brussels sleeper trainStarting in 2024, this night train will travel through Berlin, Amsterdam, Rotterdam, and other cities before reaching the Belgian capital.",2023-06-16 11:09:00,"<p>Prague and Brussels will be directly connected via a sleeper train starting in 2024, start-up European Sleeper <a data-cu='"https://europeansleeper.cdn.prismic.io/europeansleeper/f20e7c00-a213-433d-8ab0-654b79e6d248_Persbericht+mei+2023+ENG+redac.pdf'" data-cwid='"1904361'" href='"https://europeansleeper.cdn.prismic.io/europeansleeper/f20e7c00-a213-433d-8ab0-654b79e6d248_Persbericht+mei+2023+ENG+redac.pdf'" target='"_blank'">recently announced</a>. The Prague-Brussels route is an extension Brussels-Berlin night train that has recently been launched – over 10,000 tickets have already been sold for that new service, which runs thrice per week.</p><p>The new route connecting Belgium with Czechia is expected to take about 15 hours and stop at Antwerp, Rotterdam, Amsterdam, Berlin, and Dresden before arriving in Prague.</p><p>Owing to the Eurostar connection at Brussels, it also opens up the possibility of travelers being able to get all the way from London to Prague (and vice versa) using just two trains.</p><p>The route was announced in 2021 in cooperation with Czech carrier RegioJet. Two years ago, the train from Prague was planned to arrive in Brussels in the morning, in time for meetings of European institutions. In the reverse direction, it would leave Brussels in the evening and arrive in Prague in the morning. However, no official schedule has yet been published.</p><p>Travelers this summer have a range of opportunities to reach European destinations via newly launched long-distance trains. For example, <a data-cu='"https://www.expats.cz/czech-news/article/from-prague-zurich-take-a-scenic-train-journey-into-the-swiss-alps-this-summer'" data-cwid='"1904365'" href='"https://www.expats.cz/czech-news/article/from-prague-zurich-take-a-scenic-train-journey-into-the-swiss-alps-this-summer'" target='"_blank'">a sleeper train operating from Prague to the Swiss city </a>of Zürich is currently in operation. It also travels through Dresden, Leipzig, Frankfurt, and Basel.</p><p>Sleeper services will also launch this summer from Bohumín in the east of Czechia to the <a data-cu='"https://www.expats.cz/czech-news/article/czechia-launches-night-train-and-bus-to-the-baltic-sea'" data-cwid='"1904366'" href='"https://www.expats.cz/czech-news/article/czechia-launches-night-train-and-bus-to-the-baltic-sea'" target='"_blank'">Polish coastal city of Gdańsk</a>. Summer night trains with sleeping carriages have also connected Prague with Croatian destinations (such as Split, Rijeka, or Ogulin) <a data-cu='"https://www.expats.cz/czech-news/article/long-distance-train-from-prague-to-croatia-begins-2022-seasonal-service'" data-cwid='"1904366'" href='"https://www.expats.cz/czech-news/article/long-distance-train-from-prague-to-croatia-begins-2022-seasonal-service'" target='"_blank'">in the past</a>, and will continue to do so this summer. The popular Budapest is also reachable via sleeper train, as is the Slovak city of Košice.</p><p>Inter-European train travel, including sleeper services, has been expanding in recent decades. Budding travelers in Prague can also take a night train from nearby Vienna to Venice and Rome, and travel from Berlin to Stockholm via a sleeper train.</p><p>The emergence of the Prague-Brussels route will come as welcome news to keen travelers in Europe, and is also indicative of EU-wide aims to expand <a data-cu='"https://www.expats.cz/czech-news/article/high-speed-rail-connecting-with-czechia-with-other-eu-countries-under-discussion'" data-cwid='"1904368'" href='"https://www.expats.cz/czech-news/article/high-speed-rail-connecting-with-czechia-with-other-eu-countries-under-discussion'" target='"_blank'">Europe’s current cross-border transport system</a>, the Trans-European Transport Network.</p>",brussels-central-station-istock-wirestock-bklmy
f7af199e-6c1f-47dd-980b-e12785b78cab,Prague holds onto its crown as Czechia's most livable haven – do you agree?The Czech capital was praised for its healthcare and education but needs to improve in environmental and security aspects.,2023-06-16 10:35:00,"<p>Prague has once again been named Czechia’s top region to live in, <a data-cu='"https://www.expats.cz/czech-news/article/which-regions-are-ranked-the-best-places-to-live-in-czechia'" data-cwid='"1904345'" href='"https://www.expats.cz/czech-news/article/which-regions-are-ranked-the-best-places-to-live-in-czechia'" target='"_blank'">maintaining its position</a> for another year, according to the <a data-cu='"https://www.byznysakce.cz/mistoprozivot2023'" data-cwid='"1904345'" href='"https://www.byznysakce.cz/mistoprozivot2023'" target='"_blank'">Místo pro život (Place to Live) survey</a> conducted by the company Communa. Following closely behind are the Hradec Králové and Vysočina regions. On the other hand, the Karlovy Vary region ranked last.</p><p>The capital city boasts exceptional healthcare and social care services, primarily attributed to having the highest number of doctors and dentists in the country. Additionally, Prague exhibits the lowest average sickness rate and the longest life expectancy among its residents. </p><p>The region excels in education, with renowned colleges and outstanding student performance in the Czech and mathematics secondary school final exams. Prague also has good infrastructure and labor market conditions, offering residents the highest average wages in Czechia. </p><p>However, Prague faces considerable challenges in terms of its environmental and security landscape. The capital has the lowest proportion of green space within its built-up areas and has the lowest rate of waste recycling nationwide. Additionally, Prague has the highest crime rate and lowest crime resolution rate. The region also contends with a high frequency of road accidents.</p><p>In the Hradec Králové region, the survey praised the region''s superior healthcare and social services, as well as its wide array of leisure activities and hiking opportunities. The region also benefits from low municipal waste production and low crime rates. However, areas that require attention include the reduction of the unemployment rate and ensuring adequate connectivity to the sewage system. The region also grapples with a high rate of road fatalities.</p><p>The Vysočina region has balanced outcomes across all monitored categories. The region leads in terms of green space within built-up areas, accompanied by a significant volume of recycled waste. However, the survey highlights a need to improve the low number of police officers and address the high incidence of fires. Additionally, efforts should be directed toward reducing municipal waste production.</p><p>The Karlovy Vary region, previously ranking third in 2022, has now dropped to last place. Similarly, the Moravia-Silesia and Ústí nad Labem regions did not fare well this year, coming in 12th and 13th out of the 14 regions respectively.</p><p>The 13th annual comparative survey evaluated various social and environmental parameters, along with residents'' satisfaction levels. The survey relied on data obtained from public institutions and a satisfaction survey involving 1,600 respondents. The areas under scrutiny encompassed the environment, childcare, education, and safety. The survey''s organizers say they aim to inspire state and local governments, NGOs, entrepreneurs, and community members to improve conditions and the environment in their respective regions.</p><p><em>Source: Místo pro život / Communa</em></p>",view-of-prague-suburbs-from-airplane-yykkaa-ezoye
407da0d4-d12c-4e07-841f-338543628f13,"News in brief for June 16: Czechia ''not doing enough'' to tackle political corruption, EU report saysEU inflation slows, a special mushroom map released, President Pavel largely trusted, and more in our daily news feed.",2023-06-16 08:05:00,"<p>The ban on trucks weighing over 12 tons will be expanded in Prague, including in Evropska, Karlovarská, and Plzeňská streets in the west of the city, the Prague Technical Traffic Administration has announced this afternoon.  </p><p> This move aims to reduce noise and improve the environment for residents. Prague 6 transport councilor Ondřej Matěj Hrubeš expressed hope that regular – and more frequent – police checks will eliminate ultra-heavy trucks from Břevnov too. '"Vehicles over 12 tons simply don''t belong here. They excessively pollute the air and burden the surroundings with noise,” said Prague deputy mayor of transport Zdeněk Hřib.</p><p>President Petr Pavel''s spokeswoman Markéta Řeháková has clarified the president’s recent comments about stricter surveillance on Russians living in the West. Řeháková that Pavel did not imply calls for deportation or persecution. </p><p>In an interview with Radio Free Europe/Radio Liberty Thursday, Pavel had stated that increased vigilance was necessary due to Russia''s war on Ukraine. Řeháková also emphasized that the surveillance measures should target only Russian citizens with specific '"risk factors.'" Pavel also said in the interview that he sympathized with Russians living outside their country, many of whom do not approve of the invasion of Ukraine.</p><p>Analysis from the Czech Research Institute of Labour and Social Affairs released today shows that the average Czech household is expected to experience a yearly loss of CZK 7,614 following the government’s draft consolidation package. Families with children would be the most affected, while seniors would be impacted the least. </p><p>According to the analytical models, seniors living alone would lose CZK 990 per year after the nine tax changes. A single person of working age would have CZK 4,881 less and a childless couple would be worse off by CZK 11,509. The impact on a couple, at least one of whom is retired, would be CZK 2,521, according to the analysis.</p><p>With the arrival of the mushroom-picking season this June, the Czech Hydrometeorological Institute has <a data-cu='"https://info.chmi.cz/bio/mapy.php?type=houby'" data-cwid='"1904420'" href='"https://info.chmi.cz/bio/mapy.php?type=houby'" target='"_blank'">released a map</a> that forecasts the likelihood of mushroom growth nationwide. </p><p>The map is created using data that reveals previous precipitation, and the forecast model is being improved through cooperation with experts from the Czech Mycological Society. It also takes into account the average temperature of the past seven days and evaporation rates. At present, the map shows that parts of the south and east of Czechia are most likely to see mushroom growth. </p><p><a data-cu='"https://ec.europa.eu/eurostat/documents/2995521/16965667/2-16062023-AP-EN.pdf/53bd53c6-7983-f5c9-84c1-73babbb9f075'" data-cwid='"1904414'" href='"https://ec.europa.eu/eurostat/documents/2995521/16965667/2-16062023-AP-EN.pdf/53bd53c6-7983-f5c9-84c1-73babbb9f075'" target='"_blank'">Eurostat data</a> released today shows that EU inflation rates saw a notable decline in May, dropping to 7.1 percent, down by 1 percentage point from April. This marks the slowest price growth in the EU since February 2022, coinciding with Russia''s invasion of Ukraine. </p><p>In May Czechia experienced a decrease in inflation, to 12.5 percent. In the eurozone, inflation reduced from 7 percent in April to 6.1 percent, aligning with previous estimates. Monthly price levels in both the EU and eurozone remained steady.</p><p>According to a <a data-cu='"https://www.stem.cz/hodnoceni-prezidenta/#more-7610'" data-cwid='"1904424'" href='"https://www.stem.cz/hodnoceni-prezidenta/#more-7610'" target='"_blank'">survey published today </a>and conducted by the STEM agency, President Petr Pavel is perceived as a trustworthy politician by 60 percent of the Czech population. Ex-presidential candidate Andrej Babiš of the opposition ANO movement garnered support from nearly half of non-voters (in the 2023 election) and just one-quarter of those who turned out to vote.</p><p>A similar survey by the Czech Public Opinion Research Center also found that around three-fifths of the population trusted Pavel. Furthermore, the majority of respondents also believe that Pavel has significantly enhanced the prestige of the presidential office.</p><p>According to a report released today by the Council of Europe''s anti-corruption group, GRECO, Czechia has yet to fully implement most of the suggested measures to combat corruption among members of parliament (MPs), judges, and prosecutors. The country lacks a lobbying law, a code of ethics for MPs, and enforceable regulations regarding the acceptance of gifts and other benefits. The report emphasizes the need for an amendment to the prosecution law. </p><p>GRECO''s analysis reveals that Czechia has fully implemented two out of the 14 recommendations, partially implemented nine, and completely ignored three. One major area of concern is the absence of legislation governing lobbying activities and the interactions between MPs and interest groups.</p><p>President Petr Pavel, in an interview with <a data-cu='"https://www.expats.cz/czech-news/article/rfe-rl-pangea-prague-based-developers-supporting-journalists-information-war'" data-cwid='"1904323'" href='"https://www.expats.cz/czech-news/article/rfe-rl-pangea-prague-based-developers-supporting-journalists-information-war'" target='"_blank'">Radio Free Europe</a>, suggested that Russians living in the West should be subjected to increased surveillance due to their country''s aggressive war. He drew a controversial comparison to the internment of Japanese citizens in the US during World War II, where over 110,000 people, including American citizens, were held in internment camps.</p><p>The president''s spokesperson clarified that the president did not advocate for internment or persecution, but rather highlighted the history of restrictive measures against citizens of enemy countries. The Russian media criticized Pavel''s comments, with one newspaper condemning his comparison and suggesting he would send Russians to internment camps.</p><p>Passengers on the modernized railway corridor between Prague and Brno will experience longer travel times despite the significant investment of approximately CZK 10 billion crowns in the modernization, reports <a data-cu='"https://zdopravy.cz/drazni-paradox-vlaky-mezi-prahou-a-brnem-pojedou-pomaleji-nez-pred-modernizaci-za-10-miliard-korun-164985/'" data-cwid='"1904329'" href='"https://zdopravy.cz/drazni-paradox-vlaky-mezi-prahou-a-brnem-pojedou-pomaleji-nez-pred-modernizaci-za-10-miliard-korun-164985/'" target='"_blank'">Zdopravy</a>. The Railways and Czech Railways Administration attribute the delays to higher traffic density. Although high-speed trains are expected to eventually shorten the journey, they remain more of a future aspiration.</p><p>The repairs, which lasted over two years, caused significant disruptions to long-distance transportation and delays of several hours. Social media reactions criticized the situation, sarcastically remarking on the irony of investing a large sum of money only to experience slower train travel. The new timetable will take effect from July 1.</p><p>New humanitarian benefits for refugees in the Czech Republic, set to take effect in July, are being criticized by experts and aid organizations. The changes, which include the cessation of the solidarity housing allowance and a shift towards involving refugees more in the cost of living and work, are expected to encourage illegal employment and may lead to the loss of housing for refugees. </p><p>Aid organizations argue that the new rules complicate their role in advising refugees and warn of potential exploitation and abuse. Concerns have also been raised about low housing cost allowances and the potential inability of some households to cover expenses. The government is facing opposition from various stakeholders and will decide on the form of support.</p><p>The situation for Czech bakeries has been improving since the beginning of the year due to lower energy and flour prices, according to Bohumil Hlavatý, the executive director of the Association of Bakers and Confectioners in the Czech Republic <a data-cu='"https://www.ceskenoviny.cz/zpravy/svaz-pekaru-situace-pekaru-se-zlepsuje-s-poklesem-cen-energii-a-mouky/2379021'" data-cwid='"1904339'" href='"https://www.ceskenoviny.cz/zpravy/svaz-pekaru-situace-pekaru-se-zlepsuje-s-poklesem-cen-energii-a-mouky/2379021'" target='"_blank'">told ČTK</a>. While many companies still have contracts with energy suppliers from last fall, conditions are expected to improve in autumn if high energy prices do not return.</p><p>Hlavatý also highlighted the need to increase wages for bakery employees, as they are currently the lowest in the food industry. The upcoming change in the Minister of Agriculture post is seen as positive news for the industry.</p><p>The <a data-cu='"https://www.trienale-jablonec.cz/program/'" data-cwid='"1904336'" href='"https://www.trienale-jablonec.cz/program/'" target='"_blank'">International Triennial of Glass and Jewelry</a> has begun in Jablonec nad Nisou, Czech Republic, showcasing the best in utilitarian glass and jewelry. The event, organized by the Museum of Glass and Jewelry, runs until April 7 next year, and features four exhibitions and an accompanying program focusing on trends, design, art, and sustainable production.</p><p>This year''s triennial introduces young artists under 35 who work with glass. The main exhibition, '"Trendy.design.produkce,'" showcases products from various companies and studios. The Triennial also emphasizes environmental protection, demonstrating glass as a recyclable material. Visitors will have the opportunity to vote for their favorite exhibits.</p>",illustrative-image-istock-nito100-mgxeg
